[
  {
    "body": "administration réglementation gouvernance approbation consultation note porte sur un sujet clair et utile ici chaque. réglementation gouvernance approbation consultation coordination porte sur un sujet clair et utile ici chaque membre. gouvernance approbation consultation coordination planification sur un sujet clair et utile ici chaque membre reçoit. approbation consultation coordination planification élaboration un sujet clair et utile ici chaque membre reçoit copie.",
    "docType": "report-excerpt",
    "id": "1LUHJSAD4LOGDL1B2128",
    "lang": "fr",
    "readability": {
      "avgSentenceLength": 15,
      "rareWordRatio": 0.333,
      "sentences": 4
    },
    "source": {
      "kind": "derived",
      "licence": "OGL-Canada-2.0",
      "retrievedAt": "2026-09-23T00:00:00.000Z",
      "transformation": "rewritten from structure and topic only; nothing quoted",
      "url": "https://www.canada.ca/en/department-finance/programs/financial-sector-policy.html"
    },
    "status": "published",
    "targetBand": "C",
    "title": "Note finance-and-budgets 1",
    "topic": "finance-and-budgets",
    "wordCount": 60
  },
  {
    "body": "consultation coordination rappel le bureau ouvre avec les gens pour jour vers. coordination planification le bureau ouvre avec les gens pour jour vers midi. planification élaboration bureau ouvre avec les gens pour jour vers midi cette. élaboration renseignements ouvre avec les gens pour jour vers midi cette note.",
    "docType": "report-excerpt",
    "id": "7VHB0T32HBBV6PQ3F5RM",
    "lang": "fr",
    "readability": {
      "avgSentenceLength": 12,
      "rareWordRatio": 0.167,
      "sentences": 4
    },
    "source": {
      "kind": "derived",
      "licence": "public-domain",
      "licenceNote": "Federal statute, reproducible",
      "retrievedAt": "2026-09-23T00:00:00.000Z",
      "transformation": "rewritten from structure and topic only; nothing quoted",
      "url": "https://laws-lois.justice.gc.ca/eng/acts/O-3.01/"
    },
    "status": "published",
    "targetBand": "B",
    "title": "Note policy-and-legislation 1",
    "topic": "policy-and-legislation",
    "wordCount": 48
  },
  {
    "body": "réglementation gouvernance approbation consultation coordination suivi cadre envoi delai texte rappel le bureau ouvre avec. gouvernance approbation consultation coordination planification cadre envoi delai texte rappel le bureau ouvre avec les. approbation consultation coordination planification élaboration envoi delai texte rappel le bureau ouvre avec les gens. consultation coordination planification élaboration renseignements delai texte rappel le bureau ouvre avec les gens pour.",
    "docType": "bulletin",
    "id": "BP668IIDMVEV8MS538CF",
    "lang": "fr",
    "readability": {
      "avgSentenceLength": 15,
      "rareWordRatio": 0.333,
      "sentences": 4
    },
    "source": {
      "kind": "derived",
      "licence": "OGL-Canada-2.0",
      "retrievedAt": "2026-09-23T00:00:00.000Z",
      "transformation": "rewritten from structure and topic only; nothing quoted",
      "url": "https://www.canada.ca/en/employment-social-development/services/health-safety/reports.html"
    },
    "status": "published",
    "targetBand": "C",
    "title": "Note health-and-safety 1",
    "topic": "health-and-safety",
    "wordCount": 60
  },
  {
    "body": "renseignements établissement ici chaque membre reçoit copie avant la fin du mois. établissement administration chaque membre reçoit copie avant la fin du mois tard. administration réglementation membre reçoit copie avant la fin du mois tard selon. réglementation gouvernance reçoit copie avant la fin du mois tard selon usage.",
    "docType": "note",
    "id": "E0GRR6IODAR0U44NARVC",
    "lang": "fr",
    "readability": {
      "avgSentenceLength": 12,
      "rareWordRatio": 0.167,
      "sentences": 4
    },
    "source": {
      "kind": "derived",
      "licence": "canada.ca-non-commercial",
      "retrievedAt": "2026-09-23T00:00:00.000Z",
      "transformation": "rewritten from structure and topic only; nothing quoted",
      "url": "https://www.canada.ca/en/government/system/digital-government.html"
    },
    "status": "published",
    "targetBand": "B",
    "title": "Note it-and-digital 1",
    "topic": "it-and-digital",
    "wordCount": 48
  },
  {
    "body": "consultation coordination gens pour jour vers midi cette note porte sur un. coordination planification pour jour vers midi cette note porte sur un sujet. planification élaboration jour vers midi cette note porte sur un sujet clair. élaboration renseignements vers midi cette note porte sur un sujet clair et.",
    "docType": "bulletin",
    "id": "ESFMS37FO1VC8OK1AD8Q",
    "lang": "fr",
    "readability": {
      "avgSentenceLength": 12,
      "rareWordRatio": 0.167,
      "sentences": 4
    },
    "source": {
      "kind": "derived",
      "licence": "OGL-Canada-2.0",
      "licenceNote": "Open Government Licence – Canada 2.0",
      "retrievedAt": "2026-09-23T00:00:00.000Z",
      "transformation": "rewritten from structure and topic only; nothing quoted",
      "url": "https://www.canada.ca/en/treasury-board-secretariat/services/values-ethics.html"
    },
    "status": "published",
    "targetBand": "B",
    "title": "Note human-resources 1",
    "topic": "human-resources",
    "wordCount": 48
  },
  {
    "body": "renseignements établissement administration réglementation gouvernance ici chaque membre reçoit copie avant la fin du mois. administration réglementation gouvernance approbation consultation bureau ouvre avec les gens pour jour vers midi cette. réglementation gouvernance approbation consultation coordination ouvre avec les gens pour jour vers midi cette note. gouvernance approbation consultation coordination planification avec les gens pour jour vers midi cette note porte.",
    "docType": "memo",
    "id": "EUA48B4N80PEGE2F4TOK",
    "lang": "fr",
    "readability": {
      "avgSentenceLength": 15,
      "rareWordRatio": 0.333,
      "sentences": 4
    },
    "source": {
      "kind": "derived",
      "licence": "OGL-Canada-2.0",
      "retrievedAt": "2026-09-23T00:00:00.000Z",
      "transformation": "rewritten from structure and topic only; nothing quoted",
      "url": "https://www.canada.ca/en/treasury-board-secretariat/topics/project-management.html"
    },
    "status": "published",
    "targetBand": "C",
    "title": "Note project-management 1",
    "topic": "project-management",
    "wordCount": 60
  },
  {
    "body": "réglementation gouvernance reçoit copie avant la fin du mois tard selon usage. gouvernance approbation copie avant la fin du mois tard selon usage vise. approbation consultation avant la fin du mois tard selon usage vise point. consultation coordination la fin du mois tard selon usage vise point suivi.",
    "docType": "note",
    "id": "FGLVAQ144F1GPB82VJFR",
    "lang": "fr",
    "readability": {
      "avgSentenceLength": 12,
      "rareWordRatio": 0.167,
      "sentences": 4
    },
    "source": {
      "kind": "derived",
      "licence": "canada.ca-non-commercial",
      "retrievedAt": "2026-09-23T00:00:00.000Z",
      "transformation": "rewritten from structure and topic only; nothing quoted",
      "url": "https://www.tpsgc-pwgsc.gc.ca/app-acq/index-eng.html"
    },
    "status": "published",
    "targetBand": "B",
    "title": "Note procurement 1",
    "topic": "procurement",
    "wordCount": 48
  },
  {
    "body": "planification élaboration renseignements établissement administration note porte sur un sujet clair et utile ici chaque. élaboration renseignements établissement administration réglementation porte sur un sujet clair et utile ici chaque membre. renseignements établissement administration réglementation gouvernance sur un sujet clair et utile ici chaque membre reçoit. établissement administration réglementation gouvernance approbation un sujet clair et utile ici chaque membre reçoit copie.",
    "docType": "memo",
    "id": "N7L8NFJB4ITCS04D2F28",
    "lang": "fr",
    "readability": {
      "avgSentenceLength": 15,
      "rareWordRatio": 0.333,
      "sentences": 4
    },
    "source": {
      "kind": "derived",
      "licence": "OGL-Canada-2.0",
      "retrievedAt": "2026-09-23T00:00:00.000Z",
      "transformation": "rewritten from structure and topic only; nothing quoted",
      "url": "https://www.canada.ca/en/employment-social-development/services/delivery.html"
    },
    "status": "published",
    "targetBand": "C",
    "title": "Note service-delivery 1",
    "topic": "service-delivery",
    "wordCount": 60
  }
]
